{
  "problem_id": "chorale_bwv_003",
  "voices": 4,
  "chord_roots": [
    "D3",
    "D3",
    "E3",
    "E4",
    "A4",
    "E4",
    "A2",
    "E4",
    "A2",
    "E2",
    "E2",
    "A2",
    "A3",
    "D3",
    "B-3",
    "A3",
    "C4",
    "F3",
    "A4",
    "G4",
    "D3",
    "E4",
    "B-3",
    "B-2",
    "A2",
    "A2",
    "D2",
    "D3",
    "E4",
    "D3",
    "D4",
    "G3",
    "G4",
    "G2",
    "C#4",
    "D3",
    "C4",
    "F3",
    "F3",
    "A4",
    "D3",
    "C#5",
    "D4",
    "D5",
    "E4",
    "E4",
    "A3",
    "E3",
    "E3",
    "A2",
    "B4",
    "C3",
    "F3",
    "B-4",
    "F3",
    "B-2",
    "C3",
    "C3",
    "D3",
    "D3",
    "E4",
    "A2",
    "B-2",
    "F3",
    "D4",
    "C#3",
    "A3",
    "D3",
    "D3",
    "B-2",
    "E4",
    "A2",
    "A2",
    "D2"
  ],
  "chord_durations": [
    0.5,
    0.5,
    0.5,
    0.5,
    0.5,
    0.5,
    1.0,
    1.0,
    1.0,
    0.5,
    0.5,
    1.0,
    1.0,
    0.5,
    0.5,
    0.5,
    0.5,
    0.5,
    0.5,
    0.5,
    0.5,
    0.5,
    0.25,
    0.25,
    0.5,
    0.5,
    1.0,
    0.5,
    0.5,
    0.5,
    0.5,
    0.5,
    0.5,
    0.5,
    0.5,
    1.0,
    1.0,
    1.0,
    0.5,
    0.5,
    1.0,
    1.0,
    0.5,
    0.5,
    0.5,
    0.5,
    1.0,
    0.5,
    0.5,
    1.0,
    1.0,
    1.0,
    0.5,
    0.5,
    0.5,
    0.5,
    0.5,
    0.5,
    0.5,
    0.5,
    0.5,
    0.5,
    2.0,
    0.5,
    0.5,
    0.5,
    0.5,
    0.5,
    0.5,
    1.0,
    1.0,
    0.5,
    0.5,
    2.0
  ],
  "constraints": {
    "max_melodic_step": 2,
    "forbidden_parallels": [
      "P5",
      "P8"
    ],
    "max_k": 3,
    "max_k1": 1,
    "max_k2": 3,
    "max_k3": 7
  },
  "starting_pitches": [
    69,
    65,
    62,
    50
  ],
  "metadata": {
    "source": "music21_corpus",
    "original_voice_count": 4,
    "observed_tangling": {
      "events": 74,
      "crossings_total": 0,
      "crossings_avg": 0.0,
      "k": 0,
      "k_avg": 0.0,
      "k1": 0,
      "k1_avg": 0.0,
      "k2": 0,
      "k2_avg": 0.0,
      "k3": 5,
      "k3_avg": 0.2568
    },
    "voice_leading_patterns": {
      "interval_count": 211,
      "mean_abs_interval": 2.1469,
      "stepwise_ratio": 0.7962,
      "leap_resolution_ratio": 0.4167,
      "interval_histogram": {
        "-1": 31,
        "-2": 48,
        "-3": 3,
        "-4": 9,
        "-5": 6,
        "-6": 1,
        "-7": 4,
        "-8": 1,
        "0": 24,
        "1": 28,
        "12": 1,
        "2": 37,
        "3": 2,
        "4": 1,
        "5": 10,
        "7": 5
      }
    },
    "counterpoint_checks": {
      "forbidden_parallel_motion": {
        "total": 0,
        "by_type": {
          "P5": 0,
          "P8": 0
        },
        "no_forbidden_parallels": true
      },
      "bass_contrary_motion": {
        "events": 73,
        "contrary": 21,
        "similar": 20,
        "oblique": 32,
        "contrary_ratio_active": 0.5122,
        "contrary_ratio_all": 0.2877,
        "bass_mostly_contrary": true
      }
    }
  }
}