{
  "problem_id": "chorale_riemenschneider_001",
  "voices": 8,
  "chord_roots": [
    "G2",
    "G3",
    "C4",
    "E3",
    "D4",
    "G3",
    "B4",
    "D3",
    "E3",
    "C3",
    "G4",
    "C4",
    "F#4",
    "G2",
    "D3",
    "G2",
    "D4",
    "E4",
    "F#4",
    "G4",
    "A4",
    "D3",
    "D3",
    "G2",
    "G2",
    "G2",
    "G2",
    "A2",
    "F#4",
    "G4",
    "G4",
    "G4",
    "B2",
    "G4",
    "D4",
    "G2",
    "D3",
    "E3",
    "E3",
    "B3",
    "G4",
    "A4",
    "B2",
    "G4",
    "C3",
    "C5",
    "D3",
    "G2",
    "G4",
    "G4",
    "G2",
    "C3",
    "G2",
    "D4",
    "D5",
    "G2",
    "G2",
    "F#4",
    "G4",
    "G2",
    "D3",
    "D3",
    "E3",
    "E4",
    "C3",
    "F#4",
    "G4",
    "G2",
    "D3",
    "G3",
    "G3",
    "D4",
    "C5",
    "F#4",
    "E3",
    "E4",
    "A4",
    "D3",
    "D3",
    "G2"
  ],
  "chord_durations": [
    1.0,
    1.0,
    0.5,
    0.5,
    1.0,
    1.0,
    0.5,
    0.5,
    1.0,
    0.5,
    0.5,
    0.5,
    0.5,
    1.0,
    2.0,
    1.0,
    1.0,
    1.0,
    1.0,
    1.0,
    1.0,
    0.5,
    0.5,
    2.0,
    1.0,
    0.5,
    0.5,
    0.5,
    0.5,
    0.5,
    0.5,
    0.5,
    0.5,
    0.5,
    0.5,
    1.0,
    2.0,
    1.0,
    1.0,
    0.5,
    0.5,
    1.0,
    1.0,
    0.5,
    0.5,
    0.5,
    0.5,
    0.5,
    0.5,
    1.0,
    1.0,
    2.0,
    1.0,
    0.5,
    0.5,
    0.5,
    0.5,
    1.0,
    1.0,
    1.0,
    0.5,
    0.5,
    0.5,
    0.5,
    0.5,
    0.5,
    0.5,
    0.5,
    2.0,
    1.0,
    1.0,
    1.0,
    0.5,
    0.5,
    0.5,
    0.5,
    1.0,
    0.5,
    0.5,
    2.0
  ],
  "constraints": {
    "max_melodic_step": 2,
    "forbidden_parallels": [
      "P5",
      "P8"
    ],
    "max_k": 3,
    "max_k1": 1,
    "max_k2": 3,
    "max_k3": 7
  },
  "starting_pitches": [
    67,
    66,
    62,
    61,
    58,
    57,
    49,
    43
  ],
  "metadata": {
    "source": "music21_corpus",
    "original_voice_count": 4,
    "observed_tangling": {
      "events": 80,
      "crossings_total": 0,
      "crossings_avg": 0.0,
      "k": 0,
      "k_avg": 0.0,
      "k1": 0,
      "k1_avg": 0.0,
      "k2": 0,
      "k2_avg": 0.0,
      "k3": 1,
      "k3_avg": 0.05
    },
    "voice_leading_patterns": {
      "interval_count": 225,
      "mean_abs_interval": 1.9822,
      "stepwise_ratio": 0.8222,
      "leap_resolution_ratio": 0.2414,
      "interval_histogram": {
        "-1": 31,
        "-2": 52,
        "-3": 4,
        "-4": 7,
        "-5": 4,
        "-7": 4,
        "0": 32,
        "1": 25,
        "12": 1,
        "2": 45,
        "3": 5,
        "4": 4,
        "5": 6,
        "7": 5
      }
    },
    "counterpoint_checks": {
      "forbidden_parallel_motion": {
        "total": 0,
        "by_type": {
          "P5": 0,
          "P8": 0
        },
        "no_forbidden_parallels": true
      },
      "bass_contrary_motion": {
        "events": 79,
        "contrary": 25,
        "similar": 11,
        "oblique": 43,
        "contrary_ratio_active": 0.6944,
        "contrary_ratio_all": 0.3165,
        "bass_mostly_contrary": true
      }
    },
    "riemenschneider_number": 1,
    "roman_numerals": [
      "I",
      "I",
      "IV6",
      "V6",
      "I",
      "V",
      "vi",
      "IV",
      "viio6",
      "I",
      "V",
      "I",
      "V6",
      "vi6/5",
      "viio6",
      "I6",
      "ii6/5",
      "V",
      "V7",
      "I",
      "I",
      "I",
      "ii",
      "viio6",
      "I6",
      "I6",
      "V4/3",
      "I",
      "V",
      "vi",
      "vi",
      "iii6",
      "ii6",
      "I6",
      "V7",
      "I",
      "I6",
      "V7/IV",
      "IV",
      "I",
      "V6",
      "V6/5",
      "I",
      "viio6",
      "I6",
      "I",
      "V",
      "V7",
      "vi",
      "IV",
      "I",
      "V",
      "I",
      "V6",
      "IV6",
      "vi",
      "ii6/5",
      "V",
      "V7",
      "I"
    ]
  }
}