{
  "problem_id": "chorale_riemenschneider_017",
  "voices": 4,
  "chord_roots": [
    "F#3",
    "G#3",
    "F#4",
    "B3",
    "C#5",
    "F#4",
    "B3",
    "E5",
    "E5",
    "E3",
    "F#3",
    "B2",
    "F#4",
    "B3",
    "E#5",
    "F#3",
    "C#4",
    "F#3",
    "F#5",
    "F#4",
    "C#4",
    "D#5",
    "G#3",
    "C#3",
    "F#3",
    "E4",
    "E4",
    "A3",
    "B4",
    "B3",
    "E3",
    "A3",
    "A4",
    "F#4",
    "B2",
    "B2",
    "E3",
    "C#3",
    "F#3",
    "D4",
    "E4",
    "A3",
    "F#4",
    "C#4",
    "C#4",
    "F#3",
    "D4",
    "C#4",
    "A4",
    "E4",
    "A3",
    "G#4",
    "F#4",
    "G#4",
    "F#4",
    "C#3",
    "F#3"
  ],
  "chord_durations": [
    0.5,
    0.5,
    1.0,
    1.0,
    1.0,
    1.0,
    1.0,
    0.5,
    0.5,
    1.0,
    1.0,
    3.0,
    1.0,
    1.0,
    1.0,
    0.5,
    0.5,
    0.5,
    0.5,
    1.0,
    1.0,
    1.0,
    1.0,
    2.0,
    1.0,
    1.0,
    1.0,
    1.0,
    1.0,
    1.0,
    1.0,
    0.5,
    0.5,
    1.0,
    0.5,
    0.5,
    2.0,
    1.0,
    1.0,
    1.0,
    1.0,
    0.5,
    0.5,
    1.0,
    1.0,
    0.5,
    0.5,
    0.5,
    0.5,
    1.0,
    2.0,
    1.0,
    1.0,
    0.5,
    0.5,
    1.0,
    3.0
  ],
  "constraints": {
    "max_melodic_step": 2,
    "forbidden_parallels": [
      "P5",
      "P8"
    ],
    "max_k": 3,
    "max_k1": 1,
    "max_k2": 3,
    "max_k3": 7
  },
  "starting_pitches": [
    66,
    61,
    57,
    54
  ],
  "metadata": {
    "source": "music21_corpus",
    "original_voice_count": 4,
    "observed_tangling": {
      "events": 57,
      "crossings_total": 1,
      "crossings_avg": 0.0175,
      "k": 1,
      "k_avg": 0.0175,
      "k1": 0,
      "k1_avg": 0.0,
      "k2": 1,
      "k2_avg": 0.0175,
      "k3": 2,
      "k3_avg": 0.1053
    },
    "voice_leading_patterns": {
      "interval_count": 172,
      "mean_abs_interval": 2.157,
      "stepwise_ratio": 0.7733,
      "leap_resolution_ratio": 0.44,
      "interval_histogram": {
        "-1": 19,
        "-12": 1,
        "-2": 33,
        "-3": 10,
        "-4": 7,
        "-5": 2,
        "-6": 1,
        "-7": 2,
        "0": 21,
        "1": 22,
        "11": 1,
        "2": 38,
        "3": 2,
        "5": 10,
        "7": 3
      }
    },
    "counterpoint_checks": {
      "forbidden_parallel_motion": {
        "total": 0,
        "by_type": {
          "P5": 0,
          "P8": 0
        },
        "no_forbidden_parallels": true
      },
      "bass_contrary_motion": {
        "events": 56,
        "contrary": 15,
        "similar": 15,
        "oblique": 26,
        "contrary_ratio_active": 0.5,
        "contrary_ratio_all": 0.2679,
        "bass_mostly_contrary": true
      }
    },
    "riemenschneider_number": 17,
    "roman_numerals": [
      "i",
      "i6",
      "IV",
      "ii4/3",
      "V6",
      "I",
      "IV6",
      "IV7",
      "V",
      "I",
      "V6",
      "I",
      "viio6",
      "i",
      "i6",
      "i6/4",
      "ii\u00f86/5",
      "V",
      "I",
      "i",
      "VII6",
      "V6/5",
      "I",
      "V6",
      "V6/5",
      "I",
      "IV6",
      "ii6/5",
      "V",
      "V7",
      "I",
      "vi",
      "ii",
      "VI6",
      "V6/5/III",
      "III",
      "V6",
      "V6/5",
      "i",
      "v",
      "V6/III",
      "III",
      "iio6",
      "i6/4",
      "V7",
      "I"
    ]
  }
}