{
  "problem_id": "chorale_riemenschneider_012",
  "voices": 4,
  "chord_roots": [
    "A2",
    "A3",
    "A4",
    "D4",
    "G3",
    "G4",
    "G4",
    "C4",
    "C3",
    "F3",
    "C3",
    "C3",
    "C4",
    "E4",
    "A3",
    "D4",
    "G3",
    "C3",
    "C4",
    "A3",
    "D4",
    "D3",
    "G3",
    "E3",
    "A4",
    "G4",
    "B3",
    "E3",
    "A2",
    "D4",
    "G4",
    "C4",
    "D4",
    "G3",
    "B3",
    "G#3",
    "A3",
    "D3",
    "E3",
    "F3",
    "D#3",
    "E3",
    "A2"
  ],
  "chord_durations": [
    1.0,
    1.0,
    1.0,
    1.0,
    1.0,
    1.0,
    1.0,
    1.0,
    1.0,
    1.0,
    3.0,
    1.0,
    1.0,
    1.0,
    1.0,
    1.0,
    1.0,
    2.0,
    1.0,
    1.0,
    1.0,
    1.0,
    1.0,
    1.0,
    1.0,
    1.0,
    1.0,
    1.0,
    2.0,
    1.0,
    1.0,
    1.0,
    1.0,
    1.0,
    1.0,
    1.0,
    1.0,
    1.0,
    1.0,
    1.0,
    1.0,
    1.0,
    2.0
  ],
  "constraints": {
    "max_melodic_step": 2,
    "forbidden_parallels": [
      "P5",
      "P8"
    ],
    "max_k": 3,
    "max_k1": 1,
    "max_k2": 3,
    "max_k3": 7
  },
  "starting_pitches": [
    69,
    64,
    60,
    45
  ],
  "metadata": {
    "source": "music21_corpus",
    "original_voice_count": 4,
    "observed_tangling": {
      "events": 43,
      "crossings_total": 0,
      "crossings_avg": 0.0,
      "k": 0,
      "k_avg": 0.0,
      "k1": 0,
      "k1_avg": 0.0,
      "k2": 0,
      "k2_avg": 0.0,
      "k3": 1,
      "k3_avg": 0.0698
    },
    "voice_leading_patterns": {
      "interval_count": 144,
      "mean_abs_interval": 1.9653,
      "stepwise_ratio": 0.7639,
      "leap_resolution_ratio": 0.2105,
      "interval_histogram": {
        "-1": 15,
        "-2": 23,
        "-3": 10,
        "-4": 3,
        "-5": 2,
        "-7": 4,
        "0": 35,
        "1": 20,
        "12": 3,
        "2": 17,
        "3": 4,
        "4": 3,
        "5": 4,
        "8": 1
      }
    },
    "counterpoint_checks": {
      "forbidden_parallel_motion": {
        "total": 0,
        "by_type": {
          "P5": 0,
          "P8": 0
        },
        "no_forbidden_parallels": true
      },
      "bass_contrary_motion": {
        "events": 42,
        "contrary": 12,
        "similar": 9,
        "oblique": 21,
        "contrary_ratio_active": 0.5714,
        "contrary_ratio_all": 0.2857,
        "bass_mostly_contrary": true
      }
    },
    "riemenschneider_number": 12,
    "roman_numerals": [
      "i",
      "i",
      "V6",
      "I",
      "I6/4",
      "V2",
      "I6",
      "I",
      "IV",
      "I",
      "I",
      "V4/3/vi",
      "vi",
      "V6/5/V",
      "V",
      "I",
      "I",
      "vi",
      "V6/5",
      "V7",
      "I",
      "vi",
      "V6/5/V",
      "V",
      "V6/V",
      "V",
      "i",
      "iv6",
      "V2",
      "I6",
      "V6/V",
      "V",
      "viio7",
      "i",
      "iv7",
      "v7",
      "VI",
      "viio7/V",
      "V",
      "I"
    ]
  }
}