{
  "problem_id": "chorale_riemenschneider_023",
  "voices": 4,
  "chord_roots": [
    "A2",
    "A3",
    "E4",
    "A3",
    "D4",
    "G3",
    "G3",
    "G3",
    "F#4",
    "G2",
    "E4",
    "A3",
    "C5",
    "F3",
    "A4",
    "B4",
    "E3",
    "E3",
    "A2",
    "A2",
    "B2",
    "G#4",
    "A4",
    "B4",
    "E3",
    "F3",
    "D4",
    "E3",
    "E3",
    "A3",
    "G4",
    "C4",
    "E5",
    "A3",
    "A4",
    "D5",
    "D5",
    "G4",
    "D3",
    "G3",
    "G4",
    "C5",
    "D3",
    "B3",
    "C3",
    "C3",
    "A4",
    "A2",
    "B2",
    "C3",
    "D3",
    "A3",
    "G2",
    "E4",
    "A3",
    "E4",
    "F3",
    "A4",
    "B4",
    "E3",
    "E3",
    "A2"
  ],
  "chord_durations": [
    1.0,
    1.0,
    1.0,
    1.0,
    1.0,
    0.5,
    0.5,
    0.5,
    0.5,
    1.0,
    1.0,
    0.5,
    0.5,
    0.5,
    0.5,
    1.0,
    0.5,
    0.5,
    3.0,
    1.0,
    0.5,
    0.5,
    1.0,
    0.5,
    0.5,
    0.5,
    0.5,
    3.0,
    1.0,
    1.0,
    1.0,
    0.5,
    0.5,
    0.5,
    0.5,
    0.5,
    0.5,
    0.5,
    0.5,
    1.0,
    1.0,
    1.0,
    0.5,
    0.5,
    0.5,
    0.5,
    0.5,
    0.5,
    0.5,
    0.5,
    0.5,
    0.5,
    1.0,
    1.0,
    0.5,
    0.5,
    0.5,
    0.5,
    1.0,
    0.5,
    0.5,
    3.0
  ],
  "constraints": {
    "max_melodic_step": 2,
    "forbidden_parallels": [
      "P5",
      "P8"
    ],
    "max_k": 3,
    "max_k1": 1,
    "max_k2": 3,
    "max_k3": 7
  },
  "starting_pitches": [
    69,
    64,
    60,
    45
  ],
  "metadata": {
    "source": "music21_corpus",
    "original_voice_count": 4,
    "observed_tangling": {
      "events": 62,
      "crossings_total": 2,
      "crossings_avg": 0.0323,
      "k": 1,
      "k_avg": 0.0323,
      "k1": 1,
      "k1_avg": 0.0161,
      "k2": 1,
      "k2_avg": 0.0161,
      "k3": 3,
      "k3_avg": 0.129
    },
    "voice_leading_patterns": {
      "interval_count": 192,
      "mean_abs_interval": 2.2135,
      "stepwise_ratio": 0.8073,
      "leap_resolution_ratio": 0.3226,
      "interval_histogram": {
        "-1": 26,
        "-12": 2,
        "-2": 40,
        "-3": 4,
        "-4": 6,
        "-5": 1,
        "-6": 1,
        "-7": 5,
        "0": 31,
        "1": 22,
        "12": 1,
        "2": 36,
        "4": 1,
        "5": 11,
        "7": 2,
        "8": 1,
        "gt_12": 2
      }
    },
    "counterpoint_checks": {
      "forbidden_parallel_motion": {
        "total": 0,
        "by_type": {
          "P5": 0,
          "P8": 0
        },
        "no_forbidden_parallels": true
      },
      "bass_contrary_motion": {
        "events": 61,
        "contrary": 18,
        "similar": 15,
        "oblique": 28,
        "contrary_ratio_active": 0.5455,
        "contrary_ratio_all": 0.2951,
        "bass_mostly_contrary": true
      }
    },
    "riemenschneider_number": 23
  }
}