{
  "problem_id": "chorale_riemenschneider_022",
  "voices": 4,
  "chord_roots": [
    "F3",
    "C3",
    "C3",
    "D3",
    "C4",
    "F3",
    "G3",
    "F4",
    "F4",
    "G3",
    "B-4",
    "C3",
    "F2",
    "C4",
    "F3",
    "B-4",
    "B-4",
    "F3",
    "C4",
    "B-2",
    "E4",
    "F4",
    "F4",
    "F4",
    "G4",
    "F4",
    "C3",
    "F2",
    "F3",
    "E3",
    "C#4",
    "D3",
    "E3",
    "D4",
    "D4",
    "A3",
    "B3",
    "A3",
    "C4",
    "D5",
    "G3",
    "G3",
    "C3",
    "F3",
    "B-2",
    "E5",
    "F5",
    "G2",
    "F5",
    "B2",
    "C3",
    "G4",
    "C5",
    "D5",
    "C4",
    "D5",
    "C4",
    "G2",
    "C3",
    "C4",
    "F4",
    "F4",
    "E4",
    "G3",
    "G3",
    "E3",
    "F3",
    "F3",
    "G4",
    "B-2",
    "C3",
    "C3",
    "C3",
    "A2",
    "D3",
    "G2",
    "E4",
    "F4",
    "A2",
    "B-2",
    "E4",
    "F4",
    "F4",
    "F4",
    "G4",
    "F4",
    "C3",
    "F2"
  ],
  "chord_durations": [
    1.0,
    0.5,
    0.5,
    1.0,
    1.0,
    0.5,
    0.5,
    0.5,
    0.5,
    0.5,
    0.5,
    1.0,
    2.0,
    1.0,
    1.0,
    0.5,
    0.5,
    0.5,
    0.5,
    0.5,
    0.5,
    0.5,
    0.5,
    0.5,
    0.25,
    0.25,
    1.0,
    2.0,
    1.0,
    0.5,
    0.5,
    0.5,
    0.5,
    0.5,
    0.5,
    0.5,
    0.5,
    0.5,
    0.5,
    1.0,
    0.5,
    0.5,
    2.0,
    1.0,
    0.5,
    0.5,
    0.5,
    0.5,
    0.5,
    0.5,
    0.5,
    0.5,
    0.5,
    0.5,
    0.5,
    0.25,
    0.25,
    1.0,
    2.0,
    1.0,
    0.5,
    0.5,
    0.5,
    0.5,
    0.5,
    0.5,
    0.5,
    0.5,
    0.5,
    0.5,
    0.5,
    0.5,
    1.0,
    1.0,
    1.0,
    0.5,
    0.5,
    0.5,
    0.5,
    0.5,
    0.5,
    0.5,
    0.5,
    0.5,
    0.25,
    0.25,
    1.0,
    4.0
  ],
  "constraints": {
    "max_melodic_step": 2,
    "forbidden_parallels": [
      "P5",
      "P8"
    ],
    "max_k": 3,
    "max_k1": 1,
    "max_k2": 3,
    "max_k3": 7
  },
  "starting_pitches": [
    69,
    65,
    60,
    53
  ],
  "metadata": {
    "source": "music21_corpus",
    "original_voice_count": 4,
    "observed_tangling": {
      "events": 88,
      "crossings_total": 0,
      "crossings_avg": 0.0,
      "k": 0,
      "k_avg": 0.0,
      "k1": 0,
      "k1_avg": 0.0,
      "k2": 0,
      "k2_avg": 0.0,
      "k3": 5,
      "k3_avg": 0.1818
    },
    "voice_leading_patterns": {
      "interval_count": 250,
      "mean_abs_interval": 2.128,
      "stepwise_ratio": 0.844,
      "leap_resolution_ratio": 0.4,
      "interval_histogram": {
        "-1": 35,
        "-12": 1,
        "-2": 58,
        "-3": 5,
        "-4": 2,
        "-5": 3,
        "-6": 1,
        "-7": 9,
        "-8": 1,
        "0": 29,
        "1": 35,
        "11": 1,
        "12": 2,
        "2": 54,
        "3": 2,
        "4": 1,
        "5": 7,
        "7": 2,
        "8": 1,
        "9": 1
      }
    },
    "counterpoint_checks": {
      "forbidden_parallel_motion": {
        "total": 0,
        "by_type": {
          "P5": 0,
          "P8": 0
        },
        "no_forbidden_parallels": true
      },
      "bass_contrary_motion": {
        "events": 87,
        "contrary": 30,
        "similar": 12,
        "oblique": 45,
        "contrary_ratio_active": 0.7143,
        "contrary_ratio_all": 0.3448,
        "bass_mostly_contrary": true
      }
    },
    "riemenschneider_number": 22
  }
}