{
  "problem_id": "chorale_riemenschneider_007",
  "voices": 4,
  "chord_roots": [
    "A3",
    "F#3",
    "C#3",
    "D3",
    "D3",
    "E4",
    "A3",
    "B4",
    "E3",
    "A2",
    "F#4",
    "A3",
    "C#4",
    "C#4",
    "C#3",
    "F#3",
    "F#4",
    "E4",
    "A4",
    "B4",
    "E3",
    "A2",
    "A2",
    "D3",
    "G#4",
    "A3",
    "E#4",
    "B4",
    "C#5",
    "F#3",
    "G#4",
    "C#3",
    "F#2",
    "B4",
    "E3",
    "A3",
    "E4",
    "A4",
    "F#4",
    "B2",
    "B2",
    "E3",
    "C#3",
    "F#3",
    "A3",
    "D4",
    "E4",
    "B3",
    "E3",
    "A3",
    "A3",
    "A2",
    "D3",
    "A4",
    "B2",
    "B3",
    "B4",
    "G3",
    "B3",
    "C#5",
    "F#3",
    "G3",
    "C#4",
    "C#5",
    "F#3",
    "B2",
    "E3",
    "A3",
    "A3",
    "F#3",
    "B3",
    "B3",
    "G3",
    "C#3",
    "F#4",
    "C#3",
    "D3",
    "A3",
    "B4",
    "D#3",
    "E3",
    "A2",
    "E4",
    "B2",
    "E3",
    "C#3",
    "F#3",
    "D#4",
    "E3",
    "B2",
    "B2",
    "C#3",
    "B4",
    "D3",
    "A3",
    "D#3",
    "E3",
    "C#4",
    "D5",
    "E4",
    "A3",
    "E3",
    "E3",
    "F#3",
    "F#3",
    "D3",
    "B4",
    "A4",
    "E3",
    "E3",
    "A2"
  ],
  "chord_durations": [
    1.0,
    2.0,
    1.0,
    1.0,
    1.0,
    1.0,
    1.0,
    1.0,
    1.0,
    2.0,
    0.5,
    0.5,
    1.0,
    1.0,
    1.0,
    1.0,
    1.0,
    1.0,
    1.0,
    1.0,
    1.0,
    2.0,
    1.0,
    1.0,
    1.0,
    1.0,
    1.0,
    1.0,
    1.0,
    1.0,
    1.0,
    1.0,
    2.0,
    1.0,
    1.0,
    1.0,
    1.0,
    1.0,
    1.0,
    0.5,
    0.5,
    2.0,
    1.0,
    1.0,
    1.0,
    1.0,
    1.0,
    1.0,
    1.0,
    1.5,
    0.5,
    1.0,
    2.0,
    1.0,
    1.0,
    0.5,
    0.5,
    0.5,
    0.5,
    0.5,
    0.5,
    0.5,
    0.5,
    0.5,
    0.5,
    2.0,
    1.0,
    1.0,
    1.0,
    1.0,
    1.0,
    1.0,
    1.0,
    1.0,
    1.0,
    1.0,
    2.0,
    1.0,
    1.0,
    1.0,
    1.0,
    1.0,
    1.0,
    1.0,
    2.0,
    1.0,
    1.0,
    1.0,
    1.0,
    1.0,
    1.0,
    1.0,
    1.0,
    0.5,
    0.5,
    1.0,
    2.0,
    1.0,
    1.0,
    1.0,
    1.0,
    0.5,
    0.5,
    0.5,
    0.5,
    0.5,
    0.5,
    1.0,
    1.0,
    1.0,
    2.0
  ],
  "constraints": {
    "max_melodic_step": 2,
    "forbidden_parallels": [
      "P5",
      "P8"
    ],
    "max_k": 3,
    "max_k1": 1,
    "max_k2": 3,
    "max_k3": 7
  },
  "starting_pitches": [
    69,
    64,
    61,
    57
  ],
  "metadata": {
    "source": "music21_corpus",
    "original_voice_count": 4,
    "observed_tangling": {
      "events": 111,
      "crossings_total": 1,
      "crossings_avg": 0.009,
      "k": 1,
      "k_avg": 0.009,
      "k1": 0,
      "k1_avg": 0.0,
      "k2": 1,
      "k2_avg": 0.009,
      "k3": 3,
      "k3_avg": 0.045
    },
    "voice_leading_patterns": {
      "interval_count": 342,
      "mean_abs_interval": 2.2573,
      "stepwise_ratio": 0.7573,
      "leap_resolution_ratio": 0.3971,
      "interval_histogram": {
        "-1": 42,
        "-12": 1,
        "-2": 71,
        "-3": 10,
        "-4": 13,
        "-5": 5,
        "-6": 2,
        "-7": 11,
        "0": 46,
        "1": 42,
        "12": 2,
        "2": 58,
        "3": 3,
        "4": 4,
        "5": 26,
        "6": 1,
        "7": 4,
        "9": 1
      }
    },
    "counterpoint_checks": {
      "forbidden_parallel_motion": {
        "total": 0,
        "by_type": {
          "P5": 0,
          "P8": 0
        },
        "no_forbidden_parallels": true
      },
      "bass_contrary_motion": {
        "events": 110,
        "contrary": 24,
        "similar": 31,
        "oblique": 55,
        "contrary_ratio_active": 0.4364,
        "contrary_ratio_all": 0.2182,
        "bass_mostly_contrary": false
      }
    },
    "riemenschneider_number": 7,
    "roman_numerals": [
      "I",
      "vi",
      "iii",
      "IV",
      "V2",
      "I6",
      "ii6/5",
      "V",
      "I",
      "I",
      "V6/vi",
      "V7/vi",
      "vi",
      "V2",
      "I6",
      "ii6/5",
      "V",
      "I",
      "I",
      "IV",
      "I",
      "viio6",
      "V6",
      "i",
      "ii\u00f86/5",
      "V",
      "i",
      "V6/5",
      "I",
      "V2/IV",
      "IV6",
      "ii6/5",
      "V",
      "V7",
      "I",
      "vi",
      "vi",
      "IV6",
      "V6",
      "V",
      "I",
      "V7",
      "I",
      "V6",
      "vi",
      "IV",
      "iio",
      "V7",
      "VI",
      "V7",
      "I",
      "V",
      "I",
      "vi",
      "ii",
      "IV",
      "vii\u00f87",
      "I",
      "V",
      "V6",
      "V6/5",
      "I",
      "IV",
      "V",
      "V7",
      "I",
      "vi",
      "ii",
      "viio6",
      "I",
      "V",
      "V7",
      "vi",
      "v6",
      "bVII7[maj7]",
      "vii\u00f87",
      "I",
      "V6/vi",
      "IV6",
      "V6/5",
      "I",
      "V",
      "V7",
      "vi",
      "ii6/5",
      "I6/4",
      "V",
      "V7",
      "I"
    ]
  }
}