{
  "problem_id": "chorale_riemenschneider_010",
  "voices": 4,
  "chord_roots": [
    "E4",
    "A3",
    "G#4",
    "A2",
    "G4",
    "B2",
    "C3",
    "E4",
    "F#4",
    "E3",
    "E3",
    "A3",
    "G3",
    "B4",
    "C5",
    "C5",
    "F3",
    "C3",
    "C3",
    "D3",
    "D3",
    "E3",
    "A3",
    "G4",
    "A2",
    "F#4",
    "G2",
    "G3",
    "D4",
    "A4",
    "B4",
    "D3",
    "E3",
    "A2",
    "A3",
    "E3",
    "C5",
    "C3",
    "G4",
    "B2",
    "C3",
    "B4",
    "G3",
    "A4",
    "D2",
    "G2",
    "C3",
    "A2",
    "E3",
    "E3",
    "F3",
    "C3",
    "G3",
    "D4",
    "E4",
    "A2",
    "E2"
  ],
  "chord_durations": [
    2.0,
    1.0,
    1.0,
    1.0,
    0.5,
    0.5,
    0.5,
    0.5,
    1.0,
    2.0,
    2.0,
    1.0,
    0.5,
    0.5,
    0.5,
    0.5,
    1.0,
    0.5,
    0.5,
    0.5,
    0.5,
    2.0,
    2.0,
    1.0,
    0.5,
    0.5,
    0.5,
    0.5,
    0.5,
    0.5,
    0.5,
    0.5,
    1.0,
    2.0,
    2.0,
    1.0,
    0.5,
    0.5,
    0.5,
    0.5,
    1.0,
    0.5,
    0.5,
    0.5,
    0.5,
    2.0,
    2.0,
    1.0,
    0.5,
    0.5,
    1.0,
    1.0,
    1.0,
    1.0,
    1.0,
    1.0,
    2.0
  ],
  "constraints": {
    "max_melodic_step": 2,
    "forbidden_parallels": [
      "P5",
      "P8"
    ],
    "max_k": 3,
    "max_k1": 1,
    "max_k2": 3,
    "max_k3": 7
  },
  "starting_pitches": [
    71,
    64,
    56,
    50
  ],
  "metadata": {
    "source": "music21_corpus",
    "original_voice_count": 4,
    "observed_tangling": {
      "events": 57,
      "crossings_total": 1,
      "crossings_avg": 0.0175,
      "k": 1,
      "k_avg": 0.0175,
      "k1": 0,
      "k1_avg": 0.0,
      "k2": 1,
      "k2_avg": 0.0175,
      "k3": 3,
      "k3_avg": 0.2281
    },
    "voice_leading_patterns": {
      "interval_count": 179,
      "mean_abs_interval": 2.3128,
      "stepwise_ratio": 0.7877,
      "leap_resolution_ratio": 0.3529,
      "interval_histogram": {
        "-1": 29,
        "-12": 1,
        "-2": 47,
        "-3": 1,
        "-4": 2,
        "-5": 5,
        "-6": 2,
        "-7": 5,
        "0": 18,
        "1": 21,
        "12": 2,
        "2": 26,
        "3": 2,
        "4": 3,
        "5": 12,
        "7": 3
      }
    },
    "counterpoint_checks": {
      "forbidden_parallel_motion": {
        "total": 0,
        "by_type": {
          "P5": 0,
          "P8": 0
        },
        "no_forbidden_parallels": true
      },
      "bass_contrary_motion": {
        "events": 56,
        "contrary": 21,
        "similar": 16,
        "oblique": 19,
        "contrary_ratio_active": 0.5676,
        "contrary_ratio_all": 0.375,
        "bass_mostly_contrary": true
      }
    },
    "riemenschneider_number": 10,
    "roman_numerals": [
      "V2",
      "i6",
      "viio6",
      "i",
      "VII6",
      "III",
      "vio6",
      "V",
      "i",
      "V7",
      "V2",
      "I6",
      "IV",
      "I",
      "ii",
      "V",
      "i6",
      "VII6",
      "i",
      "viio6/VII",
      "VII",
      "iv6",
      "iio6",
      "V",
      "i",
      "i",
      "v",
      "III",
      "V6",
      "V6/5",
      "I",
      "I6/4",
      "V7",
      "I",
      "IV",
      "vi",
      "V/vi",
      "V7/vi",
      "IV",
      "I",
      "iv6",
      "i6/4",
      "V6/5/V",
      "i",
      "V"
    ]
  }
}