{
  "problem_id": "chorale_riemenschneider_016",
  "voices": 4,
  "chord_roots": [
    "F#3",
    "B3",
    "F#4",
    "D4",
    "E4",
    "F#3",
    "D5",
    "E3",
    "C#4",
    "D3",
    "G#4",
    "A#4",
    "B2",
    "F#3",
    "F#4",
    "B3",
    "B3",
    "C#5",
    "D4",
    "G3",
    "G3",
    "A4",
    "D3",
    "E4",
    "D#3",
    "E3",
    "E3",
    "F#3",
    "F#3",
    "G4",
    "G4",
    "D3",
    "A2",
    "A2",
    "F#3",
    "B2",
    "B2",
    "E4",
    "F#2",
    "F#3",
    "B3",
    "G#4",
    "A#4",
    "B4",
    "A#4",
    "B3",
    "A#3",
    "F#4",
    "B3",
    "F#3",
    "B3",
    "E3",
    "E3",
    "F#3",
    "D5",
    "E4",
    "F#3",
    "E3",
    "E4",
    "A3",
    "B2",
    "A3",
    "A2",
    "D3",
    "A3",
    "A3",
    "F#3",
    "D#4",
    "E3",
    "E4",
    "A#3",
    "B2",
    "A#2",
    "F#4",
    "B2",
    "G#4",
    "A4",
    "A4",
    "E3",
    "D5",
    "G#3",
    "A3",
    "F#4",
    "G4",
    "G4",
    "D4",
    "E4",
    "D3",
    "G4",
    "A3",
    "E4",
    "F#4",
    "B2",
    "B3",
    "F#2",
    "G#3",
    "F#2"
  ],
  "chord_durations": [
    1.0,
    1.0,
    0.5,
    0.5,
    1.0,
    0.5,
    0.5,
    0.5,
    0.5,
    0.5,
    0.5,
    1.0,
    1.0,
    2.0,
    1.0,
    0.5,
    0.5,
    1.0,
    1.0,
    0.5,
    0.5,
    1.0,
    0.5,
    0.5,
    1.0,
    0.5,
    0.5,
    3.0,
    1.0,
    0.5,
    0.5,
    1.0,
    0.5,
    0.5,
    1.0,
    0.5,
    0.5,
    1.0,
    1.0,
    1.0,
    0.5,
    0.5,
    1.0,
    1.0,
    0.5,
    0.5,
    0.5,
    0.5,
    1.0,
    1.0,
    1.0,
    0.5,
    0.5,
    0.5,
    0.5,
    0.5,
    0.5,
    0.5,
    0.5,
    0.5,
    0.5,
    0.5,
    0.5,
    1.0,
    0.5,
    0.5,
    0.5,
    0.5,
    0.5,
    0.5,
    0.5,
    0.5,
    0.5,
    0.5,
    0.5,
    0.5,
    0.5,
    0.5,
    1.0,
    0.5,
    0.5,
    0.5,
    0.5,
    0.5,
    0.5,
    0.5,
    0.5,
    0.5,
    0.5,
    1.0,
    1.0,
    1.0,
    1.0,
    1.0,
    0.5,
    0.5,
    1.0
  ],
  "constraints": {
    "max_melodic_step": 2,
    "forbidden_parallels": [
      "P5",
      "P8"
    ],
    "max_k": 3,
    "max_k1": 1,
    "max_k2": 3,
    "max_k3": 7
  },
  "starting_pitches": [
    73,
    66,
    58,
    54
  ],
  "metadata": {
    "source": "music21_corpus",
    "original_voice_count": 4,
    "observed_tangling": {
      "events": 98,
      "crossings_total": 0,
      "crossings_avg": 0.0,
      "k": 0,
      "k_avg": 0.0,
      "k1": 0,
      "k1_avg": 0.0,
      "k2": 0,
      "k2_avg": 0.0,
      "k3": 3,
      "k3_avg": 0.3673
    },
    "voice_leading_patterns": {
      "interval_count": 293,
      "mean_abs_interval": 1.9044,
      "stepwise_ratio": 0.8635,
      "leap_resolution_ratio": 0.4,
      "interval_histogram": {
        "-1": 47,
        "-12": 1,
        "-2": 65,
        "-3": 4,
        "-4": 3,
        "-5": 6,
        "-6": 1,
        "-7": 6,
        "0": 33,
        "1": 46,
        "12": 1,
        "2": 62,
        "3": 5,
        "4": 1,
        "5": 9,
        "7": 3
      }
    },
    "counterpoint_checks": {
      "forbidden_parallel_motion": {
        "total": 0,
        "by_type": {
          "P5": 0,
          "P8": 0
        },
        "no_forbidden_parallels": true
      },
      "bass_contrary_motion": {
        "events": 95,
        "contrary": 37,
        "similar": 22,
        "oblique": 36,
        "contrary_ratio_active": 0.6271,
        "contrary_ratio_all": 0.3895,
        "bass_mostly_contrary": true
      }
    },
    "riemenschneider_number": 16,
    "roman_numerals": [
      "V",
      "i",
      "v6",
      "iv6",
      "v",
      "iv",
      "viio6/III",
      "III",
      "viio6",
      "i",
      "V",
      "V6/5",
      "i",
      "iio6",
      "I6",
      "IV",
      "V6",
      "I",
      "viio7/iv",
      "iv",
      "V",
      "v",
      "VI6",
      "I",
      "V",
      "V7",
      "V6",
      "i",
      "iv6",
      "V",
      "V",
      "i",
      "viio6",
      "i6",
      "viio6",
      "i",
      "V6/5",
      "i",
      "V",
      "V6/5/iv",
      "IV",
      "V7",
      "vi",
      "V6",
      "V",
      "V2",
      "I6",
      "V7",
      "I",
      "I",
      "vi",
      "viio6/V",
      "V",
      "V2",
      "viio6",
      "i",
      "V6/5",
      "i",
      "viio6",
      "I6",
      "V",
      "IV6",
      "vii\u00f87",
      "I",
      "IV6",
      "I",
      "iv6",
      "i6/4",
      "V6/5/V",
      "i",
      "V"
    ]
  }
}