{
  "problem_id": "chorale_riemenschneider_025",
  "voices": 4,
  "chord_roots": [
    "F#3",
    "G#3",
    "F#4",
    "G#3",
    "E#4",
    "F#3",
    "F#3",
    "B4",
    "G#4",
    "C#3",
    "A2",
    "A3",
    "A3",
    "D#3",
    "C#5",
    "E#3",
    "F#3",
    "F#3",
    "E#4",
    "B2",
    "C#3",
    "C#3",
    "F#3",
    "D4",
    "C#4",
    "E4",
    "A3",
    "A3",
    "F#3",
    "F#4",
    "B4",
    "E3",
    "A2",
    "A2",
    "D3",
    "F#4",
    "B2",
    "G#4",
    "F#3",
    "A4",
    "D3",
    "D3",
    "A4",
    "E3",
    "A4",
    "A2",
    "A3",
    "E4",
    "A3",
    "A4",
    "F#3",
    "F#4",
    "A4",
    "A4",
    "B4",
    "B4",
    "G#4",
    "B2",
    "E3",
    "E4",
    "G#4",
    "C#4",
    "D#3",
    "C#3",
    "C#3",
    "F#3",
    "F#4",
    "B3",
    "F#4",
    "G#4",
    "C#3",
    "C#3",
    "F#2"
  ],
  "chord_durations": [
    0.5,
    0.5,
    1.0,
    0.5,
    0.5,
    0.5,
    0.5,
    0.5,
    0.5,
    2.0,
    0.5,
    0.5,
    0.5,
    0.5,
    0.5,
    0.5,
    0.5,
    0.5,
    0.5,
    0.5,
    2.0,
    1.0,
    0.5,
    0.5,
    0.5,
    0.5,
    0.5,
    0.5,
    0.5,
    0.5,
    1.0,
    1.0,
    1.0,
    1.0,
    0.5,
    0.5,
    0.5,
    0.5,
    0.5,
    0.5,
    0.5,
    0.5,
    1.0,
    0.5,
    0.5,
    1.0,
    1.0,
    1.0,
    0.5,
    0.5,
    0.5,
    0.5,
    0.5,
    0.5,
    0.5,
    0.5,
    0.5,
    0.5,
    1.0,
    0.5,
    0.5,
    0.5,
    0.5,
    0.5,
    0.5,
    0.5,
    0.5,
    0.5,
    0.5,
    1.0,
    0.5,
    0.5,
    1.0
  ],
  "constraints": {
    "max_melodic_step": 2,
    "forbidden_parallels": [
      "P5",
      "P8"
    ],
    "max_k": 3,
    "max_k1": 1,
    "max_k2": 3,
    "max_k3": 7
  },
  "starting_pitches": [
    66,
    61,
    57,
    54
  ],
  "metadata": {
    "source": "music21_corpus",
    "original_voice_count": 4,
    "observed_tangling": {
      "events": 75,
      "crossings_total": 0,
      "crossings_avg": 0.0,
      "k": 0,
      "k_avg": 0.0,
      "k1": 0,
      "k1_avg": 0.0,
      "k2": 0,
      "k2_avg": 0.0,
      "k3": 3,
      "k3_avg": 0.04
    },
    "voice_leading_patterns": {
      "interval_count": 200,
      "mean_abs_interval": 1.775,
      "stepwise_ratio": 0.85,
      "leap_resolution_ratio": 0.5455,
      "interval_histogram": {
        "-1": 27,
        "-2": 41,
        "-3": 4,
        "-4": 7,
        "-6": 1,
        "-7": 4,
        "0": 42,
        "1": 21,
        "12": 1,
        "2": 39,
        "3": 2,
        "4": 2,
        "5": 8,
        "7": 1
      }
    },
    "counterpoint_checks": {
      "forbidden_parallel_motion": {
        "total": 0,
        "by_type": {
          "P5": 0,
          "P8": 0
        },
        "no_forbidden_parallels": true
      },
      "bass_contrary_motion": {
        "events": 70,
        "contrary": 18,
        "similar": 9,
        "oblique": 43,
        "contrary_ratio_active": 0.6667,
        "contrary_ratio_all": 0.2571,
        "bass_mostly_contrary": true
      }
    },
    "riemenschneider_number": 25
  }
}