{
  "problem_id": "chorale_bwv_005",
  "voices": 4,
  "chord_roots": [
    "G2",
    "A4",
    "G3",
    "G3",
    "A4",
    "C3",
    "D3",
    "D4",
    "G4",
    "F#4",
    "G3",
    "C3",
    "D3",
    "D3",
    "G2",
    "G3",
    "F4",
    "A3",
    "F3",
    "B-3",
    "B-4",
    "G3",
    "G4",
    "C5",
    "G4",
    "A4",
    "A4",
    "C5",
    "D3",
    "G3",
    "C3",
    "A4",
    "B-2",
    "E-5",
    "F3",
    "F3",
    "B-2",
    "F3",
    "B-4",
    "C5",
    "F3",
    "B-2",
    "D4",
    "G3",
    "G2",
    "A2",
    "F#4",
    "G4",
    "G4",
    "D2",
    "D2",
    "E-2",
    "C2",
    "D2",
    "B3",
    "D2",
    "G2"
  ],
  "chord_durations": [
    0.5,
    0.5,
    0.5,
    0.5,
    0.5,
    0.5,
    0.5,
    0.5,
    0.5,
    0.5,
    0.5,
    0.5,
    0.5,
    0.5,
    1.0,
    1.0,
    0.5,
    0.5,
    1.0,
    0.5,
    0.5,
    0.5,
    0.5,
    0.5,
    0.5,
    0.25,
    0.25,
    0.5,
    1.0,
    1.0,
    0.5,
    0.5,
    0.5,
    0.5,
    0.5,
    0.5,
    1.0,
    0.5,
    0.5,
    0.5,
    0.5,
    1.0,
    1.0,
    0.5,
    0.5,
    0.5,
    0.5,
    0.5,
    0.5,
    0.5,
    0.5,
    0.5,
    0.5,
    0.5,
    0.25,
    0.25,
    2.0
  ],
  "constraints": {
    "max_melodic_step": 2,
    "forbidden_parallels": [
      "P5",
      "P8"
    ],
    "max_k": 3,
    "max_k1": 1,
    "max_k2": 3,
    "max_k3": 7
  },
  "starting_pitches": [
    67,
    62,
    58,
    43
  ],
  "metadata": {
    "source": "music21_corpus",
    "original_voice_count": 4,
    "observed_tangling": {
      "events": 57,
      "crossings_total": 3,
      "crossings_avg": 0.0526,
      "k": 1,
      "k_avg": 0.0526,
      "k1": 1,
      "k1_avg": 0.0351,
      "k2": 1,
      "k2_avg": 0.0175,
      "k3": 7,
      "k3_avg": 0.7193
    },
    "voice_leading_patterns": {
      "interval_count": 160,
      "mean_abs_interval": 2.5562,
      "stepwise_ratio": 0.7438,
      "leap_resolution_ratio": 0.4167,
      "interval_histogram": {
        "-1": 25,
        "-10": 1,
        "-12": 1,
        "-2": 27,
        "-3": 2,
        "-4": 7,
        "-6": 2,
        "-7": 7,
        "-8": 1,
        "0": 14,
        "1": 24,
        "10": 1,
        "12": 3,
        "2": 29,
        "3": 2,
        "4": 4,
        "5": 8,
        "7": 1,
        "8": 1
      }
    },
    "counterpoint_checks": {
      "forbidden_parallel_motion": {
        "total": 0,
        "by_type": {
          "P5": 0,
          "P8": 0
        },
        "no_forbidden_parallels": true
      },
      "bass_contrary_motion": {
        "events": 56,
        "contrary": 15,
        "similar": 13,
        "oblique": 28,
        "contrary_ratio_active": 0.5357,
        "contrary_ratio_all": 0.2679,
        "bass_mostly_contrary": true
      }
    }
  }
}