{
  "problem_id": "chorale_riemenschneider_013",
  "voices": 4,
  "chord_roots": [
    "A3",
    "A3",
    "C4",
    "E3",
    "F3",
    "B4",
    "C5",
    "G3",
    "C3",
    "A3",
    "G3",
    "G3",
    "G3",
    "A3",
    "D4",
    "C5",
    "G2",
    "C3",
    "C3",
    "G3",
    "G3",
    "A3",
    "A3",
    "E3",
    "A3",
    "E3",
    "E4",
    "A4",
    "F#4",
    "G#4",
    "A3",
    "G#3",
    "E4",
    "A3",
    "A3",
    "D3",
    "D3",
    "E3",
    "C4",
    "E3",
    "A2",
    "A3",
    "D3",
    "A4",
    "B3",
    "D5",
    "E3",
    "E3",
    "A3",
    "C5",
    "D5",
    "D5",
    "E5",
    "A3",
    "D3",
    "E4",
    "F5",
    "A2",
    "B2",
    "G4",
    "C3",
    "C4",
    "C4",
    "D5",
    "E5",
    "A3",
    "C5",
    "C5",
    "G3",
    "G3",
    "A4",
    "D#3",
    "E3",
    "E3",
    "F4",
    "A2",
    "D3",
    "F3",
    "D4",
    "D3",
    "A3",
    "F3",
    "G4",
    "D4",
    "C5",
    "D3",
    "C5",
    "C5",
    "G3",
    "C3",
    "C3",
    "D4",
    "D3",
    "G#4",
    "G#4",
    "A2",
    "B2",
    "A2",
    "E4",
    "D5",
    "B3",
    "F2",
    "A4",
    "A4",
    "B4",
    "E2",
    "E2",
    "A2"
  ],
  "chord_durations": [
    0.5,
    0.5,
    0.5,
    0.5,
    0.5,
    0.5,
    0.5,
    0.5,
    0.5,
    0.5,
    0.5,
    0.25,
    0.25,
    0.5,
    0.5,
    1.0,
    1.0,
    2.0,
    1.0,
    0.5,
    0.5,
    0.5,
    0.5,
    0.5,
    0.5,
    0.5,
    0.5,
    0.5,
    0.5,
    0.5,
    0.5,
    0.5,
    0.5,
    0.5,
    0.5,
    0.5,
    0.5,
    0.5,
    0.25,
    0.25,
    1.0,
    1.0,
    0.5,
    0.5,
    0.5,
    0.5,
    0.5,
    0.5,
    0.5,
    0.5,
    0.5,
    0.5,
    0.5,
    0.5,
    1.0,
    1.0,
    0.5,
    0.5,
    0.5,
    0.5,
    0.5,
    0.5,
    1.0,
    1.0,
    1.0,
    1.0,
    0.5,
    0.5,
    0.5,
    0.5,
    0.5,
    0.5,
    0.5,
    0.5,
    0.5,
    0.5,
    0.5,
    0.5,
    0.5,
    0.5,
    1.0,
    1.0,
    0.5,
    0.5,
    0.5,
    0.5,
    0.5,
    0.5,
    1.0,
    1.0,
    1.0,
    0.5,
    0.5,
    0.5,
    0.5,
    0.5,
    0.5,
    0.5,
    0.5,
    0.5,
    0.5,
    0.5,
    0.25,
    0.25,
    1.0,
    0.5,
    0.5,
    1.0
  ],
  "constraints": {
    "max_melodic_step": 2,
    "forbidden_parallels": [
      "P5",
      "P8"
    ],
    "max_k": 3,
    "max_k1": 1,
    "max_k2": 3,
    "max_k3": 7
  },
  "starting_pitches": [
    72,
    64,
    57,
    56
  ],
  "metadata": {
    "source": "music21_corpus",
    "original_voice_count": 4,
    "observed_tangling": {
      "events": 109,
      "crossings_total": 0,
      "crossings_avg": 0.0,
      "k": 0,
      "k_avg": 0.0,
      "k1": 0,
      "k1_avg": 0.0,
      "k2": 0,
      "k2_avg": 0.0,
      "k3": 7,
      "k3_avg": 0.4312
    },
    "voice_leading_patterns": {
      "interval_count": 301,
      "mean_abs_interval": 2.1429,
      "stepwise_ratio": 0.8206,
      "leap_resolution_ratio": 0.4,
      "interval_histogram": {
        "-1": 42,
        "-12": 1,
        "-2": 67,
        "-3": 3,
        "-4": 7,
        "-5": 7,
        "-6": 2,
        "-7": 8,
        "0": 36,
        "1": 35,
        "12": 2,
        "2": 67,
        "3": 4,
        "4": 2,
        "5": 12,
        "7": 5,
        "9": 1
      }
    },
    "counterpoint_checks": {
      "forbidden_parallel_motion": {
        "total": 1,
        "by_type": {
          "P5": 1,
          "P8": 0
        },
        "no_forbidden_parallels": false
      },
      "bass_contrary_motion": {
        "events": 106,
        "contrary": 43,
        "similar": 15,
        "oblique": 48,
        "contrary_ratio_active": 0.7414,
        "contrary_ratio_all": 0.4057,
        "bass_mostly_contrary": true
      }
    },
    "riemenschneider_number": 13,
    "roman_numerals": [
      "i",
      "I6",
      "IV",
      "I6",
      "I",
      "V",
      "ii7/V",
      "V4/3/V",
      "vi6/V",
      "V",
      "I",
      "I",
      "V",
      "V7",
      "vi",
      "v",
      "v2",
      "i6",
      "viio6",
      "i",
      "viio7",
      "i",
      "iv7",
      "V",
      "V7",
      "i",
      "i",
      "iv7",
      "iv6",
      "V",
      "V7",
      "i",
      "iv6",
      "V6/5/iv",
      "iv",
      "V6",
      "VI6",
      "V6/III",
      "III",
      "III6",
      "IV6/5",
      "V6",
      "i",
      "IV6",
      "I",
      "IV6",
      "i",
      "V",
      "i",
      "V",
      "IV",
      "V2",
      "I6",
      "V",
      "I",
      "IV2",
      "viio6",
      "i",
      "iv6",
      "i6/4",
      "ii\u00f86/5",
      "V",
      "V7",
      "I"
    ]
  }
}