{
  "problem_id": "chorale_riemenschneider_006",
  "voices": 4,
  "chord_roots": [
    "F2",
    "F3",
    "C4",
    "F4",
    "B-4",
    "C3",
    "D3",
    "C4",
    "C3",
    "F3",
    "B-2",
    "F4",
    "G2",
    "E4",
    "F2",
    "F4",
    "F4",
    "C3",
    "F2",
    "F3",
    "B2",
    "G4",
    "C3",
    "C3",
    "C3",
    "D3",
    "D4",
    "A3",
    "A4",
    "D5",
    "D3",
    "G3",
    "C3",
    "F2",
    "G2",
    "E4",
    "F4",
    "G4",
    "C3",
    "C3",
    "F2"
  ],
  "chord_durations": [
    1.0,
    1.0,
    1.0,
    1.0,
    1.0,
    0.5,
    0.5,
    0.5,
    0.5,
    1.0,
    1.0,
    1.0,
    0.5,
    0.5,
    0.5,
    0.5,
    0.5,
    0.5,
    2.0,
    1.0,
    0.5,
    0.5,
    0.5,
    0.25,
    0.25,
    0.5,
    0.5,
    0.5,
    0.5,
    0.5,
    0.5,
    1.0,
    1.0,
    1.0,
    0.5,
    0.5,
    1.0,
    1.0,
    0.75,
    0.25,
    3.0
  ],
  "constraints": {
    "max_melodic_step": 2,
    "forbidden_parallels": [
      "P5",
      "P8"
    ],
    "max_k": 3,
    "max_k1": 1,
    "max_k2": 3,
    "max_k3": 7
  },
  "starting_pitches": [
    65,
    60,
    57,
    41
  ],
  "metadata": {
    "source": "music21_corpus",
    "original_voice_count": 4,
    "observed_tangling": {
      "events": 42,
      "crossings_total": 0,
      "crossings_avg": 0.0,
      "k": 0,
      "k_avg": 0.0,
      "k1": 0,
      "k1_avg": 0.0,
      "k2": 0,
      "k2_avg": 0.0,
      "k3": 2,
      "k3_avg": 0.0476
    },
    "voice_leading_patterns": {
      "interval_count": 121,
      "mean_abs_interval": 2.314,
      "stepwise_ratio": 0.7273,
      "leap_resolution_ratio": 0.3478,
      "interval_histogram": {
        "-1": 16,
        "-2": 24,
        "-3": 4,
        "-4": 4,
        "-6": 1,
        "-7": 6,
        "0": 19,
        "1": 10,
        "12": 2,
        "2": 19,
        "3": 4,
        "4": 4,
        "5": 8
      }
    },
    "counterpoint_checks": {
      "forbidden_parallel_motion": {
        "total": 0,
        "by_type": {
          "P5": 0,
          "P8": 0
        },
        "no_forbidden_parallels": true
      },
      "bass_contrary_motion": {
        "events": 39,
        "contrary": 11,
        "similar": 12,
        "oblique": 16,
        "contrary_ratio_active": 0.4783,
        "contrary_ratio_all": 0.2821,
        "bass_mostly_contrary": false
      }
    },
    "riemenschneider_number": 6,
    "roman_numerals": [
      "I",
      "I",
      "V6",
      "V2/IV",
      "IV6",
      "V",
      "I",
      "IV",
      "I6",
      "ii7",
      "viio6",
      "I",
      "V",
      "I",
      "I",
      "V6/5",
      "I",
      "ii",
      "vi",
      "ii6/5",
      "V",
      "I",
      "IV",
      "viio6",
      "I6",
      "ii6/5",
      "V",
      "V7",
      "I"
    ]
  }
}