{
  "problem_id": "chorale_bwv_021",
  "voices": 4,
  "chord_roots": [
    "A3",
    "E4",
    "A3",
    "A2",
    "A3",
    "G3",
    "C4",
    "C3",
    "C4",
    "E5",
    "A3",
    "C5",
    "D5",
    "G#3",
    "A3",
    "A3",
    "B4",
    "E3",
    "E3",
    "A2",
    "A2",
    "B2",
    "A4",
    "A2",
    "D3",
    "D4",
    "B-2",
    "B-4",
    "E5",
    "E2",
    "A2",
    "A2",
    "G4",
    "E4",
    "D2",
    "G2",
    "A2",
    "G4",
    "G2",
    "C3",
    "C4",
    "A2",
    "A4",
    "D5",
    "D2",
    "G2",
    "G2",
    "F4",
    "D4",
    "C2",
    "F3",
    "D5",
    "D3",
    "E4",
    "E4",
    "D5",
    "A3",
    "B4",
    "E3",
    "E3",
    "D4",
    "B3",
    "A2"
  ],
  "chord_durations": [
    1.0,
    1.0,
    1.0,
    1.0,
    1.0,
    1.0,
    1.0,
    1.0,
    0.5,
    0.5,
    0.5,
    0.5,
    0.5,
    0.5,
    0.5,
    0.5,
    1.0,
    0.5,
    0.5,
    2.0,
    0.5,
    0.5,
    0.5,
    0.5,
    0.5,
    0.5,
    0.5,
    0.5,
    0.5,
    0.5,
    0.5,
    0.5,
    0.5,
    0.5,
    1.0,
    0.5,
    0.5,
    0.5,
    0.5,
    0.5,
    0.5,
    0.5,
    0.5,
    0.5,
    0.5,
    0.5,
    0.5,
    0.5,
    0.5,
    1.0,
    1.0,
    0.5,
    0.5,
    0.5,
    0.5,
    0.5,
    0.5,
    1.0,
    0.5,
    0.5,
    0.5,
    0.5,
    1.0
  ],
  "constraints": {
    "max_melodic_step": 2,
    "forbidden_parallels": [
      "P5",
      "P8"
    ],
    "max_k": 3,
    "max_k1": 1,
    "max_k2": 3,
    "max_k3": 7
  },
  "starting_pitches": [
    69,
    64,
    60,
    57
  ],
  "metadata": {
    "source": "music21_corpus",
    "original_voice_count": 4,
    "observed_tangling": {
      "events": 63,
      "crossings_total": 0,
      "crossings_avg": 0.0,
      "k": 0,
      "k_avg": 0.0,
      "k1": 0,
      "k1_avg": 0.0,
      "k2": 0,
      "k2_avg": 0.0,
      "k3": 6,
      "k3_avg": 0.619
    },
    "voice_leading_patterns": {
      "interval_count": 183,
      "mean_abs_interval": 2.2131,
      "stepwise_ratio": 0.7814,
      "leap_resolution_ratio": 0.3333,
      "interval_histogram": {
        "-1": 20,
        "-12": 5,
        "-2": 30,
        "-3": 7,
        "-4": 3,
        "-5": 3,
        "-6": 2,
        "-7": 2,
        "0": 49,
        "1": 19,
        "12": 3,
        "2": 25,
        "3": 1,
        "4": 1,
        "5": 11,
        "7": 1,
        "gt_12": 1
      }
    },
    "counterpoint_checks": {
      "forbidden_parallel_motion": {
        "total": 1,
        "by_type": {
          "P5": 1,
          "P8": 0
        },
        "no_forbidden_parallels": false
      },
      "bass_contrary_motion": {
        "events": 62,
        "contrary": 9,
        "similar": 9,
        "oblique": 44,
        "contrary_ratio_active": 0.5,
        "contrary_ratio_all": 0.1452,
        "bass_mostly_contrary": true
      }
    }
  }
}