{
  "problem_id": "chorale_riemenschneider_024",
  "voices": 4,
  "chord_roots": [
    "D3",
    "A3",
    "D3",
    "E3",
    "D4",
    "D3",
    "G3",
    "G3",
    "C#5",
    "A3",
    "G4",
    "G4",
    "D3",
    "E4",
    "D2",
    "D4",
    "B4",
    "A#3",
    "B3",
    "B4",
    "G#3",
    "A3",
    "D3",
    "D3",
    "E5",
    "D4",
    "D5",
    "B3",
    "D4",
    "E4",
    "E3",
    "F#3",
    "G#3",
    "A3",
    "G#3",
    "F#3",
    "C#5",
    "F#3",
    "F#3",
    "F#3",
    "B3",
    "G#4",
    "A4",
    "A4",
    "A4",
    "B4",
    "E3",
    "E2",
    "A2",
    "A3",
    "D3",
    "E3",
    "D4",
    "D3",
    "G3",
    "C#4",
    "D4",
    "F#4",
    "B3",
    "E3",
    "E3",
    "B2",
    "D4",
    "G2",
    "G4",
    "B2",
    "B3",
    "E4",
    "E2",
    "A2",
    "A2",
    "D2"
  ],
  "chord_durations": [
    0.5,
    0.5,
    0.5,
    0.5,
    0.5,
    0.5,
    0.5,
    0.5,
    0.5,
    0.5,
    0.5,
    0.5,
    0.5,
    0.5,
    1.0,
    0.5,
    0.5,
    1.0,
    0.5,
    0.5,
    1.0,
    1.0,
    3.0,
    0.5,
    0.5,
    0.5,
    0.5,
    0.5,
    0.5,
    0.5,
    0.5,
    0.5,
    0.5,
    0.5,
    0.5,
    0.5,
    0.5,
    1.0,
    0.5,
    0.5,
    0.5,
    0.5,
    0.5,
    0.5,
    0.5,
    0.5,
    0.5,
    0.5,
    3.0,
    1.0,
    0.5,
    0.5,
    0.5,
    0.5,
    0.5,
    0.5,
    0.5,
    0.5,
    1.0,
    0.5,
    0.5,
    1.0,
    1.0,
    0.5,
    0.5,
    0.5,
    0.5,
    0.5,
    0.5,
    0.5,
    0.5,
    3.0
  ],
  "constraints": {
    "max_melodic_step": 2,
    "forbidden_parallels": [
      "P5",
      "P8"
    ],
    "max_k": 3,
    "max_k1": 1,
    "max_k2": 3,
    "max_k3": 7
  },
  "starting_pitches": [
    62,
    57,
    54,
    50
  ],
  "metadata": {
    "source": "music21_corpus",
    "original_voice_count": 4,
    "observed_tangling": {
      "events": 72,
      "crossings_total": 0,
      "crossings_avg": 0.0,
      "k": 0,
      "k_avg": 0.0,
      "k1": 0,
      "k1_avg": 0.0,
      "k2": 0,
      "k2_avg": 0.0,
      "k3": 7,
      "k3_avg": 0.6944
    },
    "voice_leading_patterns": {
      "interval_count": 209,
      "mean_abs_interval": 2.2392,
      "stepwise_ratio": 0.7943,
      "leap_resolution_ratio": 0.4242,
      "interval_histogram": {
        "-1": 30,
        "-12": 3,
        "-2": 44,
        "-3": 5,
        "-4": 7,
        "-5": 3,
        "-7": 4,
        "0": 33,
        "1": 21,
        "12": 2,
        "2": 38,
        "3": 3,
        "4": 3,
        "5": 11,
        "7": 1,
        "gt_12": 1
      }
    },
    "counterpoint_checks": {
      "forbidden_parallel_motion": {
        "total": 1,
        "by_type": {
          "P5": 1,
          "P8": 0
        },
        "no_forbidden_parallels": false
      },
      "bass_contrary_motion": {
        "events": 71,
        "contrary": 17,
        "similar": 14,
        "oblique": 40,
        "contrary_ratio_active": 0.5484,
        "contrary_ratio_all": 0.2394,
        "bass_mostly_contrary": true
      }
    },
    "riemenschneider_number": 24
  }
}