{
  "problem_id": "chorale_riemenschneider_019",
  "voices": 4,
  "chord_roots": [
    "G3",
    "G3",
    "D4",
    "E-3",
    "C#4",
    "D3",
    "D4",
    "G4",
    "G2",
    "A4",
    "D4",
    "C#3",
    "A3",
    "D3",
    "D3",
    "D4",
    "F#4",
    "D3",
    "D3",
    "D4",
    "C3",
    "G3",
    "C3",
    "C4",
    "F#4",
    "F#4",
    "D3",
    "B-3",
    "D3",
    "G2",
    "F3",
    "F3",
    "F4",
    "F3",
    "C4",
    "F3",
    "F4",
    "E-3",
    "B-3",
    "E-3",
    "E3",
    "F3",
    "F#3",
    "G3",
    "G2",
    "G4",
    "D3",
    "E-3",
    "C4",
    "D3",
    "D3",
    "F#4",
    "B-2",
    "F#4",
    "D4",
    "G3",
    "G3",
    "C3",
    "A3",
    "C#3",
    "D3",
    "G3",
    "D2",
    "B-3",
    "D2",
    "C4",
    "G2"
  ],
  "chord_durations": [
    1.0,
    0.5,
    0.5,
    0.5,
    0.5,
    0.5,
    0.5,
    0.5,
    0.5,
    0.5,
    0.5,
    0.5,
    0.5,
    1.0,
    0.5,
    0.5,
    0.5,
    0.5,
    0.5,
    0.5,
    0.5,
    0.5,
    0.5,
    0.5,
    0.5,
    0.5,
    0.5,
    0.25,
    0.25,
    1.0,
    1.0,
    0.5,
    0.5,
    0.5,
    0.5,
    0.5,
    0.5,
    0.5,
    0.5,
    0.5,
    0.5,
    0.5,
    0.5,
    1.0,
    1.0,
    0.5,
    0.5,
    0.5,
    0.5,
    1.0,
    1.0,
    0.5,
    0.5,
    0.5,
    0.5,
    0.5,
    0.5,
    0.25,
    0.25,
    0.5,
    0.5,
    0.5,
    0.25,
    0.25,
    0.5,
    0.5,
    0.5
  ],
  "constraints": {
    "max_melodic_step": 2,
    "forbidden_parallels": [
      "P5",
      "P8"
    ],
    "max_k": 3,
    "max_k1": 1,
    "max_k2": 3,
    "max_k3": 7
  },
  "starting_pitches": [
    67,
    62,
    58,
    55
  ],
  "metadata": {
    "source": "music21_corpus",
    "original_voice_count": 4,
    "observed_tangling": {
      "events": 67,
      "crossings_total": 0,
      "crossings_avg": 0.0,
      "k": 0,
      "k_avg": 0.0,
      "k1": 0,
      "k1_avg": 0.0,
      "k2": 0,
      "k2_avg": 0.0,
      "k3": 5,
      "k3_avg": 0.2239
    },
    "voice_leading_patterns": {
      "interval_count": 179,
      "mean_abs_interval": 1.6257,
      "stepwise_ratio": 0.8492,
      "leap_resolution_ratio": 0.4375,
      "interval_histogram": {
        "-1": 25,
        "-12": 2,
        "-2": 30,
        "-3": 4,
        "-4": 1,
        "-5": 1,
        "-7": 3,
        "0": 50,
        "1": 27,
        "10": 1,
        "2": 20,
        "3": 6,
        "4": 2,
        "5": 6,
        "7": 1
      }
    },
    "counterpoint_checks": {
      "forbidden_parallel_motion": {
        "total": 0,
        "by_type": {
          "P5": 0,
          "P8": 0
        },
        "no_forbidden_parallels": true
      },
      "bass_contrary_motion": {
        "events": 66,
        "contrary": 13,
        "similar": 8,
        "oblique": 45,
        "contrary_ratio_active": 0.619,
        "contrary_ratio_all": 0.197,
        "bass_mostly_contrary": true
      }
    },
    "riemenschneider_number": 19,
    "roman_numerals": [
      "i",
      "i",
      "It6",
      "V",
      "V2",
      "i6",
      "i",
      "iio6",
      "viio7/V",
      "V",
      "V",
      "V7",
      "V2",
      "V6/iv",
      "iv",
      "viio6",
      "viio6/5",
      "V7",
      "i",
      "I",
      "I",
      "V6",
      "I",
      "V2/IV",
      "IV6",
      "VI",
      "vi\u00f87",
      "VII",
      "viio7",
      "i",
      "i",
      "V",
      "iv6",
      "V",
      "V",
      "viio6",
      "viio4/3",
      "V2",
      "I6",
      "V6/iv",
      "IV",
      "viio7/V",
      "V",
      "V7",
      "I"
    ]
  }
}