{
  "problem_id": "chorale_riemenschneider_011",
  "voices": 4,
  "chord_roots": [
    "C3",
    "C3",
    "C3",
    "C4",
    "G4",
    "C4",
    "F4",
    "F5",
    "F4",
    "F3",
    "B-3",
    "D4",
    "G3",
    "G4",
    "C4",
    "C4",
    "C4",
    "F3",
    "F3",
    "G3",
    "C3",
    "F5",
    "F5",
    "C3",
    "C3",
    "C3",
    "C3",
    "C3",
    "C3",
    "C3",
    "C3",
    "C3",
    "C3",
    "F5",
    "F5",
    "F5",
    "F5",
    "C3",
    "D5",
    "C3",
    "G2",
    "D5",
    "G3",
    "D5",
    "G3",
    "D5",
    "G4",
    "G3",
    "C4",
    "C4",
    "G4",
    "F3",
    "C5",
    "F3",
    "C5",
    "C5",
    "G3",
    "G3",
    "A3",
    "C4",
    "D5",
    "D5",
    "G3",
    "G2",
    "C3",
    "F5",
    "F5",
    "C3",
    "C3",
    "C3",
    "C3",
    "C3",
    "C3",
    "C3",
    "C3",
    "C3",
    "C3",
    "F5",
    "F5",
    "F5",
    "F5",
    "C3",
    "D5",
    "C3",
    "G2",
    "G3",
    "E4",
    "F#4",
    "B4",
    "E3",
    "E4",
    "C3",
    "E4",
    "A2",
    "A2",
    "B4",
    "F4",
    "B4",
    "E4",
    "G4",
    "G3",
    "G4",
    "E3",
    "G4",
    "F4",
    "C3",
    "C3",
    "C3",
    "C3",
    "C4",
    "G4",
    "A3",
    "G4",
    "D4",
    "E5",
    "F5",
    "F5",
    "B3",
    "C4",
    "C3",
    "G3",
    "D5",
    "E4",
    "F4",
    "C#5",
    "A3",
    "B-3",
    "D4",
    "E4",
    "D3",
    "A3",
    "E4",
    "E4",
    "A3",
    "D5",
    "B3",
    "C4",
    "D3",
    "D3",
    "B3",
    "D3",
    "G3",
    "G3",
    "C3",
    "A3",
    "D3",
    "E3",
    "D4",
    "C#5",
    "F3",
    "C#5",
    "D4",
    "G3",
    "G2",
    "D3",
    "A2",
    "A4",
    "C3",
    "C4",
    "C4",
    "C3",
    "G4",
    "G3",
    "C4",
    "C4",
    "D3",
    "F5",
    "D4",
    "D3",
    "G3",
    "G4",
    "G3",
    "G4",
    "E3",
    "E4",
    "C4",
    "D4",
    "C5",
    "F3",
    "G3",
    "G2",
    "C3",
    "F5",
    "F5",
    "C3",
    "C3",
    "C3",
    "C3",
    "C3",
    "C3",
    "C3",
    "C3",
    "C3",
    "C3",
    "F5",
    "F5",
    "F5",
    "F5",
    "C3",
    "D5",
    "C3"
  ],
  "chord_durations": [
    1.0,
    0.5,
    0.5,
    1.0,
    1.0,
    1.0,
    0.5,
    0.5,
    0.5,
    0.5,
    1.0,
    1.0,
    0.5,
    0.5,
    0.5,
    0.25,
    0.25,
    0.5,
    0.5,
    1.0,
    0.5,
    0.5,
    0.5,
    0.25,
    0.25,
    0.5,
    0.25,
    0.25,
    0.25,
    0.25,
    0.25,
    0.25,
    0.5,
    0.25,
    0.25,
    0.25,
    0.25,
    0.25,
    0.25,
    1.0,
    0.5,
    0.5,
    0.5,
    0.5,
    0.5,
    0.5,
    0.5,
    0.5,
    0.5,
    0.5,
    1.0,
    0.5,
    0.5,
    1.0,
    0.5,
    0.5,
    0.5,
    0.5,
    0.5,
    0.5,
    0.5,
    0.5,
    0.5,
    0.5,
    0.5,
    0.5,
    0.5,
    0.25,
    0.25,
    0.5,
    0.25,
    0.25,
    0.25,
    0.25,
    0.25,
    0.25,
    0.5,
    0.25,
    0.25,
    0.25,
    0.25,
    0.25,
    0.25,
    1.0,
    1.0,
    0.5,
    0.5,
    0.5,
    0.5,
    0.5,
    0.5,
    0.5,
    0.5,
    2.0,
    1.0,
    1.0,
    0.5,
    0.5,
    0.5,
    0.5,
    0.5,
    0.5,
    0.5,
    0.5,
    1.0,
    0.5,
    0.5,
    1.0,
    1.0,
    1.0,
    1.0,
    1.0,
    1.0,
    1.0,
    1.0,
    1.0,
    1.0,
    1.0,
    2.0,
    1.0,
    1.0,
    1.0,
    1.0,
    1.0,
    1.0,
    1.0,
    1.0,
    1.0,
    1.0,
    2.0,
    1.0,
    1.0,
    1.0,
    1.0,
    1.0,
    1.0,
    1.0,
    0.5,
    0.5,
    0.5,
    0.5,
    0.5,
    0.5,
    2.0,
    1.0,
    1.0,
    1.0,
    1.0,
    1.0,
    1.0,
    1.0,
    1.0,
    1.0,
    1.0,
    2.0,
    0.5,
    0.5,
    0.5,
    0.5,
    0.5,
    0.5,
    0.5,
    0.5,
    0.5,
    0.5,
    0.5,
    0.5,
    0.5,
    0.5,
    0.5,
    0.5,
    0.5,
    0.5,
    0.5,
    0.5,
    0.5,
    0.5,
    0.5,
    0.5,
    0.5,
    0.5,
    0.5,
    0.5,
    0.5,
    0.25,
    0.25,
    0.5,
    0.25,
    0.25,
    0.25,
    0.25,
    0.25,
    0.25,
    0.5,
    0.25,
    0.25,
    0.25,
    0.25,
    0.25,
    0.25,
    1.0
  ],
  "constraints": {
    "max_melodic_step": 2,
    "forbidden_parallels": [
      "P5",
      "P8"
    ],
    "max_k": 3,
    "max_k1": 1,
    "max_k2": 3,
    "max_k3": 7
  },
  "starting_pitches": [
    79,
    57,
    45,
    44
  ],
  "metadata": {
    "source": "music21_corpus",
    "original_voice_count": 9,
    "observed_tangling": {
      "events": 201,
      "crossings_total": 339,
      "crossings_avg": 1.6866,
      "k": 5,
      "k_avg": 1.4328,
      "k1": 12,
      "k1_avg": 0.9303,
      "k2": 2,
      "k2_avg": 0.7562,
      "k3": 5,
      "k3_avg": 0.3284
    },
    "voice_leading_patterns": {
      "interval_count": 695,
      "mean_abs_interval": 1.9899,
      "stepwise_ratio": 0.8014,
      "leap_resolution_ratio": 0.181,
      "interval_histogram": {
        "-1": 67,
        "-12": 15,
        "-2": 114,
        "-3": 7,
        "-4": 13,
        "-5": 10,
        "-7": 10,
        "-8": 1,
        "-9": 2,
        "0": 207,
        "1": 61,
        "12": 6,
        "2": 108,
        "3": 14,
        "4": 16,
        "5": 37,
        "7": 7
      }
    },
    "counterpoint_checks": {
      "forbidden_parallel_motion": {
        "total": 34,
        "by_type": {
          "P5": 0,
          "P8": 34
        },
        "no_forbidden_parallels": false
      },
      "bass_contrary_motion": {
        "events": 21,
        "contrary": 0,
        "similar": 0,
        "oblique": 21,
        "contrary_ratio_active": 0.0,
        "contrary_ratio_all": 0.0,
        "bass_mostly_contrary": false
      }
    },
    "riemenschneider_number": 11,
    "roman_numerals": [
      "I",
      "I",
      "V6",
      "V2/IV",
      "IV6",
      "I",
      "IV",
      "V6/ii",
      "V",
      "V2",
      "I6",
      "IV",
      "V",
      "I",
      "V",
      "I",
      "V4/3",
      "I6",
      "I",
      "IV",
      "V7",
      "I",
      "V6",
      "V",
      "vi",
      "ii6/5",
      "V",
      "V7",
      "I",
      "V",
      "I",
      "V6/5/vi",
      "vi",
      "V6/4",
      "i",
      "ii\u00f86/5",
      "ii\u00f84/3",
      "v6",
      "V",
      "V2",
      "V4/3",
      "I",
      "I",
      "I",
      "V6",
      "vi7",
      "V6",
      "V",
      "IV6",
      "vii\u00f87",
      "I",
      "V",
      "i6/4",
      "ii\u00f84/3",
      "V",
      "V7",
      "VI",
      "i6/4",
      "ii\u00f86/5",
      "i",
      "v",
      "V6",
      "V6/5",
      "i",
      "iv6",
      "vii\u00f84/3",
      "I6",
      "ii7",
      "V7",
      "I",
      "V6/5",
      "i",
      "i6",
      "viio6",
      "viio4/3",
      "V6/iv",
      "iv",
      "I",
      "v",
      "VII",
      "V2",
      "I6",
      "ii7",
      "V",
      "V",
      "V2",
      "I6",
      "I6/4",
      "V",
      "V7",
      "I"
    ]
  }
}