{
  "problem_id": "chorale_riemenschneider_009",
  "voices": 4,
  "chord_roots": [
    "G3",
    "G4",
    "E3",
    "C4",
    "D3",
    "D3",
    "G3",
    "A3",
    "D5",
    "D5",
    "D5",
    "D5",
    "A2",
    "D3",
    "B3",
    "B4",
    "C5",
    "F#3",
    "G3",
    "C3",
    "D4",
    "B2",
    "G4",
    "G2",
    "G4",
    "D2",
    "D2",
    "G2",
    "D3",
    "E4",
    "D4",
    "A4",
    "B3",
    "G#4",
    "A3",
    "A3",
    "D#3",
    "A4",
    "A4",
    "E2",
    "E2",
    "A2",
    "E3",
    "B4",
    "E4",
    "C4",
    "E4",
    "E4",
    "A3",
    "D5",
    "A#3",
    "F#4",
    "E5",
    "E5",
    "B2",
    "E3",
    "D3",
    "D4",
    "G4",
    "G5",
    "G2",
    "G4",
    "C5",
    "F#2",
    "G2",
    "E2",
    "A4",
    "G4",
    "A4",
    "A2",
    "D3",
    "G4",
    "B2",
    "C3",
    "C3",
    "D3",
    "B3",
    "C5",
    "F#3",
    "G3",
    "C5",
    "A4",
    "F#3",
    "A4",
    "D3",
    "G2"
  ],
  "chord_durations": [
    0.5,
    0.5,
    0.5,
    0.5,
    0.5,
    0.5,
    0.5,
    0.5,
    0.5,
    0.5,
    0.5,
    0.5,
    1.0,
    1.0,
    0.5,
    0.5,
    0.5,
    0.5,
    0.5,
    0.5,
    0.5,
    0.5,
    0.5,
    0.5,
    1.0,
    0.5,
    0.5,
    1.0,
    0.5,
    0.5,
    0.5,
    0.5,
    0.5,
    0.5,
    0.5,
    0.5,
    1.0,
    0.5,
    0.5,
    0.5,
    0.5,
    1.0,
    0.5,
    0.5,
    0.5,
    0.5,
    0.5,
    0.5,
    0.5,
    0.5,
    0.5,
    0.5,
    0.5,
    0.5,
    1.0,
    1.0,
    0.5,
    0.5,
    0.5,
    0.5,
    0.5,
    0.5,
    0.5,
    0.5,
    0.5,
    0.5,
    0.5,
    0.5,
    0.5,
    0.5,
    1.0,
    0.5,
    0.5,
    0.5,
    0.5,
    0.5,
    0.5,
    0.5,
    0.5,
    0.5,
    0.5,
    0.5,
    0.25,
    0.25,
    1.0,
    1.0
  ],
  "constraints": {
    "max_melodic_step": 2,
    "forbidden_parallels": [
      "P5",
      "P8"
    ],
    "max_k": 3,
    "max_k1": 1,
    "max_k2": 3,
    "max_k3": 7
  },
  "starting_pitches": [
    67,
    62,
    59,
    55
  ],
  "metadata": {
    "source": "music21_corpus",
    "original_voice_count": 4,
    "observed_tangling": {
      "events": 86,
      "crossings_total": 0,
      "crossings_avg": 0.0,
      "k": 0,
      "k_avg": 0.0,
      "k1": 0,
      "k1_avg": 0.0,
      "k2": 0,
      "k2_avg": 0.0,
      "k3": 5,
      "k3_avg": 0.5233
    },
    "voice_leading_patterns": {
      "interval_count": 235,
      "mean_abs_interval": 2.1957,
      "stepwise_ratio": 0.817,
      "leap_resolution_ratio": 0.4242,
      "interval_histogram": {
        "-1": 24,
        "-12": 5,
        "-2": 44,
        "-3": 6,
        "-4": 5,
        "-5": 1,
        "-6": 1,
        "-7": 5,
        "-8": 1,
        "0": 33,
        "1": 37,
        "12": 1,
        "2": 54,
        "3": 2,
        "4": 1,
        "5": 11,
        "7": 3,
        "9": 1
      }
    },
    "counterpoint_checks": {
      "forbidden_parallel_motion": {
        "total": 0,
        "by_type": {
          "P5": 0,
          "P8": 0
        },
        "no_forbidden_parallels": true
      },
      "bass_contrary_motion": {
        "events": 85,
        "contrary": 21,
        "similar": 14,
        "oblique": 50,
        "contrary_ratio_active": 0.6,
        "contrary_ratio_all": 0.2471,
        "bass_mostly_contrary": true
      }
    },
    "riemenschneider_number": 9,
    "roman_numerals": [
      "I",
      "vi",
      "V7",
      "I",
      "V2",
      "I6",
      "V",
      "V7",
      "I",
      "V6/vi",
      "V6/5/vi",
      "IV6",
      "vii\u00f87",
      "I",
      "IV7",
      "V2",
      "I",
      "V",
      "V7",
      "I",
      "V",
      "V",
      "viio6",
      "i",
      "vii\u00f87/V",
      "V",
      "V7",
      "i",
      "i",
      "V4/3",
      "i6",
      "V6/5/iv",
      "iv",
      "V6/5/V",
      "V",
      "V7",
      "i",
      "V",
      "I6",
      "I",
      "IV6",
      "viio",
      "I",
      "vi",
      "V6/5/V",
      "V7/V",
      "V",
      "I6",
      "IV",
      "V7",
      "IV6/5",
      "viio",
      "I",
      "ii6/5",
      "V",
      "I"
    ]
  }
}