{
  "problem_id": "chorale_bwv_015",
  "voices": 4,
  "chord_roots": [
    "G3",
    "C3",
    "C4",
    "C4",
    "F4",
    "G3",
    "C3",
    "C3",
    "C4",
    "G2",
    "C3",
    "C3",
    "A4",
    "G3",
    "B-4",
    "C4",
    "C5",
    "C3",
    "C4",
    "A2",
    "A4",
    "B-4",
    "G3",
    "A4",
    "D3",
    "G2",
    "G3",
    "B-3",
    "C3",
    "B-2",
    "F3",
    "E-3",
    "G3",
    "C3",
    "D4",
    "E-4",
    "E-4",
    "B-2",
    "B-2",
    "E-2",
    "E-3",
    "C4",
    "G3",
    "G4",
    "C3",
    "C4",
    "F3",
    "F4",
    "F2",
    "D4",
    "C4",
    "G2",
    "G2",
    "C3",
    "G3",
    "C3",
    "C3",
    "F3",
    "D4",
    "E-3",
    "G4",
    "F4",
    "A4",
    "B-2",
    "F3",
    "G4",
    "C3",
    "F2",
    "F3",
    "B-2",
    "B-2",
    "C3",
    "D3",
    "C4",
    "A4",
    "G3",
    "G3",
    "D3",
    "D3",
    "E-3",
    "G3",
    "A4",
    "D3",
    "D3",
    "G2"
  ],
  "chord_durations": [
    1.0,
    0.5,
    0.5,
    1.0,
    1.0,
    1.0,
    0.5,
    0.5,
    0.5,
    0.5,
    1.0,
    0.5,
    0.5,
    0.5,
    0.5,
    0.5,
    0.5,
    0.5,
    0.5,
    0.5,
    0.5,
    0.5,
    0.5,
    0.5,
    0.5,
    1.0,
    1.0,
    0.5,
    0.5,
    0.5,
    0.5,
    0.5,
    0.5,
    0.5,
    0.5,
    0.5,
    0.5,
    0.5,
    0.5,
    1.0,
    0.5,
    0.5,
    0.5,
    0.5,
    0.5,
    0.5,
    0.5,
    0.5,
    0.5,
    0.5,
    1.0,
    0.5,
    0.5,
    1.0,
    1.0,
    0.5,
    0.5,
    0.5,
    0.5,
    0.5,
    0.5,
    0.5,
    0.5,
    0.5,
    0.5,
    0.5,
    0.5,
    1.0,
    1.0,
    0.5,
    0.5,
    0.5,
    0.5,
    0.5,
    0.5,
    0.5,
    0.5,
    0.5,
    0.5,
    0.5,
    0.5,
    1.0,
    0.5,
    0.5,
    3.0
  ],
  "constraints": {
    "max_melodic_step": 2,
    "forbidden_parallels": [
      "P5",
      "P8"
    ],
    "max_k": 3,
    "max_k1": 1,
    "max_k2": 3,
    "max_k3": 7
  },
  "starting_pitches": [
    67,
    62,
    55,
    47
  ],
  "metadata": {
    "source": "music21_corpus",
    "original_voice_count": 4,
    "observed_tangling": {
      "events": 85,
      "crossings_total": 0,
      "crossings_avg": 0.0,
      "k": 0,
      "k_avg": 0.0,
      "k1": 0,
      "k1_avg": 0.0,
      "k2": 0,
      "k2_avg": 0.0,
      "k3": 2,
      "k3_avg": 0.0235
    },
    "voice_leading_patterns": {
      "interval_count": 235,
      "mean_abs_interval": 2.2596,
      "stepwise_ratio": 0.8043,
      "leap_resolution_ratio": 0.4419,
      "interval_histogram": {
        "-1": 36,
        "-2": 61,
        "-4": 3,
        "-5": 9,
        "-6": 2,
        "-7": 6,
        "0": 29,
        "1": 29,
        "12": 3,
        "2": 34,
        "3": 2,
        "4": 4,
        "5": 8,
        "7": 6,
        "8": 2,
        "9": 1
      }
    },
    "counterpoint_checks": {
      "forbidden_parallel_motion": {
        "total": 0,
        "by_type": {
          "P5": 0,
          "P8": 0
        },
        "no_forbidden_parallels": true
      },
      "bass_contrary_motion": {
        "events": 84,
        "contrary": 21,
        "similar": 17,
        "oblique": 46,
        "contrary_ratio_active": 0.5526,
        "contrary_ratio_all": 0.25,
        "bass_mostly_contrary": true
      }
    }
  }
}